{"jsonrpc":"2.0","id":"badge","method":"metadata.set_display","params":{"protocol":"1.0","deadline":"2099-01-01T00:00:00Z","idempotencyKey":"ik_2000000000_0123456789abcdef0123456789abcdef","paneRef":"cpp_0123456789abcdef0123456789abcdef","badge":"ready","expectations":[{"kind":"pane","paneRef":"cpp_0123456789abcdef0123456789abcdef","generation":1,"resourceVersion":1,"material":{"lifecycle":"active"}}]}}
